regulatory-compliance/cloud-foundation/9.1/cis-csc-8-1/vcf-91-companion-cis-csc-8-1-scg-by-control.csv

Control ID,Description,Bridging SCF Controls,Relevant SCG Controls
2.2,Ensure Authorized Software is Currently Supported,TDA-17,"esx-9.supported, vcenter-9.supported"
2.5,Allowlist Authorized Software,CFG-03.2,esx-9.vib-trusted-binaries
2.7,Allowlist Authorized Scripts,IAC-16,"esx-9.ad-admin-group-autoadd, vcenter-9.bashshelladministrators"
3.1,Establish and Maintain a Data Management Process,"CRY-01, CRY-03","automation-9.oidc-settings, esx-9.entropy, esx-9.hardware-cpu-amd-cc, esx-9.hardware-cpu-intel-cc, esx-9.log-forwarding-tls-ciphers, esx-9.nfs-traffic-protection, esx-9.tls-ciphers, esx-9.vmk-storage, esx-9.vmk-vmotion, esx-9.vmotion-encryption-offload, nsx-9.load-balancer-fips, nsx-9.tls-ciphers, operations-9.logs-ssl-api, operations-9.logs-ssl-syslog, vcenter-9.smtp, vcenter-9.snmp3, vcenter-9.tls-ciphers, vm-9.ft-encrypted, vm-9.vmotion-encrypted, vsan-9.encryption-transit-esa, vsan-9.encryption-transit-osa, vsan-9.file-services-authentication-smb, vsan-9.storage-cluster-traffic-protection"
3.3,Configure Data Access Control Lists,NET-04,"esx-9.network-bpdu, esx-9.network-dvfilter, esx-9.network-rpf-promisc, esx-9.network-standard-reject-forged-transmit, esx-9.network-standard-reject-mac-changes, esx-9.network-standard-reject-promiscuous-mode, vcenter-9.network-reject-promiscuous-mode-dvportgroup, vcenter-9.network-restrict-netflow-usage, vcenter-9.network-vgt, vm-9.dvfilter, vsan-9.file-services-access-control-nfs"
3.6,Encrypt Data on End-User Devices,"CRY-01, CRY-05","esx-9.entropy, esx-9.hardware-cpu-amd-cc, esx-9.hardware-cpu-intel-cc, esx-9.memory-tiering-encryption, esx-9.tpm-configuration, nsx-9.load-balancer-fips, vcenter-9.snmp3, vsan-9.encryption-rest"
3.9,Encrypt Data on Removable Media,"CRY-01, CRY-05","esx-9.entropy, esx-9.hardware-cpu-amd-cc, esx-9.hardware-cpu-intel-cc, esx-9.memory-tiering-encryption, esx-9.tpm-configuration, nsx-9.load-balancer-fips, vcenter-9.snmp3, vsan-9.encryption-rest"
3.11,Encrypt Sensitive Data at Rest,"CRY-01, CRY-05","esx-9.entropy, esx-9.hardware-cpu-amd-cc, esx-9.hardware-cpu-intel-cc, esx-9.memory-tiering-encryption, esx-9.tpm-configuration, nsx-9.load-balancer-fips, vcenter-9.snmp3, vsan-9.encryption-rest"
3.14,Log Sensitive Data Access,"MON-02, MON-03","esx-9.hardware-management-log-forwarding, esx-9.log-audit-forwarding, esx-9.log-audit-local, esx-9.log-filter, esx-9.log-forwarding, esx-9.log-level, guest-9.tools-log-forwarding, guest-9.tools-logs, networks-9.audit-identity, nsx-9.log-level, operations-9.log-collection, pnr-9.log-forwarding, vcenter-9.log-forwarding, vcenter-9.logs-level-global, vm-9.log-enable"
4.0,"Secure Configuration of Enterprise Assets and Software: Establish and maintain the secure configuration of enterprise assets (end-user devices, including portable and mobile; network devices; non-computing/IoT devices; and servers) and software (operating systems and applications).",CFG-03,"automation-9.activity-log, esx-9.ceip-disable, esx-9.deactivate-mob, esx-9.deactivate-shell, esx-9.forensic-snapshots, esx-9.hardware-management-security, esx-9.hardware-ports, esx-9.hardware-virtual-nic, esx-9.network-dvfilter, esx-9.snmp, esx-9.ssh, guest-9.tools-deactivate-appinfo, guest-9.tools-deactivate-containerinfo, guest-9.tools-deactivate-guestoperations, guest-9.tools-deactivate-gueststoreupgrade, guest-9.tools-deactivate-servicediscovery, installer-9.security, nsx-9.ceip-disable, nsx-9.dhcp-disable, nsx-9.multicast-disable, nsx-9.snmp, nsx-9.ssh, nsx-9.t1-dhcp-disable, nsx-9.t1-multicast-disable, operations-9.ceip-disable, operations-9.in-page-feedback, pnr-9.ssh, vcenter-9.ceip-disable, vcenter-9.client-feedback, vcenter-9.client-telemetry, vcenter-9.network-restrict-discovery-protocol, vcenter-9.snmp, vcenter-9.ssh, vcenter-9.vds-health-check-disable, vm-9.deactivate-console-copy, vm-9.deactivate-console-paste, vm-9.deactivate-disk-shrinking-shrink, vm-9.deactivate-disk-shrinking-wiper, vm-9.deactivate-non-essential-3d-features, vm-9.dvfilter, vm-9.efi-boot-types, vm-9.isolation-device-connectable-deactivate, vm-9.isolation-tools-dnd-deactivate, vm-9.pci-passthrough, vm-9.persistent-disk, vm-9.remove-unnecessary-devices, vm-9.restrict-host-info, vsan-9.hcl-internet"
4.1,Establish and Maintain a Secure Configuration Process,"CFG-02, IAC-22","esx-9.account-lockout-duration, esx-9.account-lockout-max-attempts, fleet-9.password-policy, nsx-9.account-lockout-max-attempts, operations-9.account-lockout, vcenter-9.account-lockout-duration, vcenter-9.account-lockout-max-attempts, vcenter-9.account-lockout-reset, vcf-9.secure-baseline"
4.2,Establish and Maintain a Secure Configuration Process for NetworkInfrastructure,CFG-02,vcf-9.secure-baseline
4.3,Configure Automatic Session Locking on Enterprise Assets,"CFG-02, IAC-24","vcf-9.secure-baseline, vm-9.vmrc-lock"
4.4,Implement and Manage a Firewall on Servers,"CFG-02, END-05","esx-9.firewall-restrict-access, vcenter-9.vami-firewall-restrict-access, vcf-9.secure-baseline"
4.5,Implement and Manage a Firewall on End-User Devices,"CFG-02, END-05","esx-9.firewall-restrict-access, vcenter-9.vami-firewall-restrict-access, vcf-9.secure-baseline"
4.6,Securely Manage Enterprise Assets and Software,"CFG-02, CFG-03, NET-04","automation-9.activity-log, esx-9.ceip-disable, esx-9.deactivate-mob, esx-9.deactivate-shell, esx-9.forensic-snapshots, esx-9.hardware-management-security, esx-9.hardware-ports, esx-9.hardware-virtual-nic, esx-9.network-bpdu, esx-9.network-dvfilter, esx-9.network-rpf-promisc, esx-9.network-standard-reject-forged-transmit, esx-9.network-standard-reject-mac-changes, esx-9.network-standard-reject-promiscuous-mode, esx-9.snmp, esx-9.ssh, guest-9.tools-deactivate-appinfo, guest-9.tools-deactivate-containerinfo, guest-9.tools-deactivate-guestoperations, guest-9.tools-deactivate-gueststoreupgrade, guest-9.tools-deactivate-servicediscovery, installer-9.security, nsx-9.ceip-disable, nsx-9.dhcp-disable, nsx-9.multicast-disable, nsx-9.snmp, nsx-9.ssh, nsx-9.t1-dhcp-disable, nsx-9.t1-multicast-disable, operations-9.ceip-disable, operations-9.in-page-feedback, pnr-9.ssh, vcenter-9.ceip-disable, vcenter-9.client-feedback, vcenter-9.client-telemetry, vcenter-9.network-reject-promiscuous-mode-dvportgroup, vcenter-9.network-restrict-discovery-protocol, vcenter-9.network-restrict-netflow-usage, vcenter-9.network-vgt, vcenter-9.snmp, vcenter-9.ssh, vcenter-9.vds-health-check-disable, vcf-9.secure-baseline, vm-9.deactivate-console-copy, vm-9.deactivate-console-paste, vm-9.deactivate-disk-shrinking-shrink, vm-9.deactivate-disk-shrinking-wiper, vm-9.deactivate-non-essential-3d-features, vm-9.dvfilter, vm-9.efi-boot-types, vm-9.isolation-device-connectable-deactivate, vm-9.isolation-tools-dnd-deactivate, vm-9.pci-passthrough, vm-9.persistent-disk, vm-9.remove-unnecessary-devices, vm-9.restrict-host-info, vsan-9.file-services-access-control-nfs, vsan-9.hcl-internet"
4.7,Manage Default Accounts on Enterprise Assets and Software,"CFG-02, IAC-10.8","esx-9.ad-admin-group-name, esx-9.hardware-management-security, sddc-9.api-admin, vcf-9.secure-baseline"
4.8,Uninstall or Disable Unnecessary Services on Enterprise Assets and Software,"CFG-02, CFG-03","automation-9.activity-log, esx-9.ceip-disable, esx-9.deactivate-mob, esx-9.deactivate-shell, esx-9.forensic-snapshots, esx-9.hardware-management-security, esx-9.hardware-ports, esx-9.hardware-virtual-nic, esx-9.network-dvfilter, esx-9.snmp, esx-9.ssh, guest-9.tools-deactivate-appinfo, guest-9.tools-deactivate-containerinfo, guest-9.tools-deactivate-guestoperations, guest-9.tools-deactivate-gueststoreupgrade, guest-9.tools-deactivate-servicediscovery, installer-9.security, nsx-9.ceip-disable, nsx-9.dhcp-disable, nsx-9.multicast-disable, nsx-9.snmp, nsx-9.ssh, nsx-9.t1-dhcp-disable, nsx-9.t1-multicast-disable, operations-9.ceip-disable, operations-9.in-page-feedback, pnr-9.ssh, vcenter-9.ceip-disable, vcenter-9.client-feedback, vcenter-9.client-telemetry, vcenter-9.network-restrict-discovery-protocol, vcenter-9.snmp, vcenter-9.ssh, vcenter-9.vds-health-check-disable, vcf-9.secure-baseline, vm-9.deactivate-console-copy, vm-9.deactivate-console-paste, vm-9.deactivate-disk-shrinking-shrink, vm-9.deactivate-disk-shrinking-wiper, vm-9.deactivate-non-essential-3d-features, vm-9.dvfilter, vm-9.efi-boot-types, vm-9.isolation-device-connectable-deactivate, vm-9.isolation-tools-dnd-deactivate, vm-9.pci-passthrough, vm-9.persistent-disk, vm-9.remove-unnecessary-devices, vm-9.restrict-host-info, vsan-9.hcl-internet"
4.9,Configure Trusted DNS Servers on Enterprise Assets,NET-10,fleet-9.dns
5.1,Establish and Maintain an Inventory of Accounts,IAC-16,"esx-9.ad-admin-group-autoadd, vcenter-9.bashshelladministrators"
5.2,Use Unique Passwords,"IAC-10, IAC-10.1","automation-9.oidc-settings, automation-9.timeouts, esx-9.account-password-history, esx-9.password-complexity, esx-9.password-max-age, fleet-9.access-token, fleet-9.api-token, fleet-9.password-policy, nsx-9.password-complexity, operations-9.password-complexity, sddc-9.basic-auth-disable, vcenter-9.password-complexity, vcenter-9.password-history, vcenter-9.password-max-age, vcenter-9.vami-password-max-age, vcenter-9.vpxuser-length"
5.3,Disable Dormant Accounts,IAC-15.3,fleet-9.jit-inactivity
5.4,Restrict Administrator Privileges to Dedicated Administrator Accounts,"IAC-16, IAC-21","esx-9.ad-admin-group-autoadd, esx-9.lockdown-dcui-access, esx-9.lockdown-exception-users, vcenter-9.bashshelladministrators, vcf-9.permissions-roles, vm-9.isolation-device-connectable-deactivate, vm-9.pci-passthrough"
5.5,Establish and Maintain an Inventory of Service Accounts,IAC-02,vcf-9.mfa
5.6,Centralize Account Management,"IAC-01.2, IAC-02","vcenter-9.administration-sso-groups, vcf-9.mfa"
6.1,Establish an Access Granting Process,IAC-07,operations-9.non-imported-vidm
6.2,Establish an Access Revoking Process,IAC-07,operations-9.non-imported-vidm
6.5,Require MFA for Administrative Access,IAC-06.1,vcf-9.mfa
6.6,Establish and Maintain an Inventory of Authentication andAuthorization Systems,IAC-01.2,vcenter-9.administration-sso-groups
6.7,Centralize Access Control,IAC-02,vcf-9.mfa
7.0,"Continuous Vulnerability Management: Develop a plan to continuously assess and track vulnerabilities on all enterprise assets within the enterprise’s infrastructure, in order to remediate, and minimize, the window of opportunity for attackers. Monitor public and private industry sources for new threat and vulnerability information.",VPM-04,esx-9.supported
7.3,Perform Automated Operating System Patch Management,VPM-05,"esx-9.hardware-firmware-updates, esx-9.updates, guest-9.tools-updates, guest-9.tools-upgrade, vcenter-9.vami-updates, vm-9.virtual-hardware"
7.4,Perform Automated Application Patch Management,"VPM-05, VPM-05.4","esx-9.hardware-firmware-updates, esx-9.updates, guest-9.tools-updates, guest-9.tools-upgrade, vcenter-9.vami-updates, vm-9.virtual-hardware"
7.7,Remediate Detected Vulnerabilities,VPM-04,esx-9.supported
8.1,Establish and Maintain an Audit Log Management Process,"MON-02, MON-04, MON-10","automation-9.activity-log, esx-9.hardware-boot, esx-9.hardware-management-log-forwarding, esx-9.log-audit-forwarding, esx-9.log-audit-local-capacity, esx-9.log-audit-persistent, esx-9.log-forwarding, esx-9.log-persistent, guest-9.tools-log-forwarding, operations-9.action-history-retention, operations-9.log-collection, operations-9.log-retention, pnr-9.log-forwarding, vcenter-9.events-database-retention, vcenter-9.log-forwarding, vm-9.log-retention, vm-9.log-rotation-size"
8.2,Collect Audit Logs,"MON-01.4, MON-02, MON-02.7, MON-03","esx-9.cpu-hyperthread-warning, esx-9.hardware-management-log-forwarding, esx-9.log-audit-forwarding, esx-9.log-audit-local, esx-9.log-filter, esx-9.log-forwarding, esx-9.log-level, esx-9.shell-warning, guest-9.tools-log-forwarding, guest-9.tools-logs, networks-9.audit-identity, nsx-9.log-level, operations-9.log-collection, pnr-9.log-forwarding, vcenter-9.events-remote-logging, vcenter-9.log-forwarding, vcenter-9.logs-level-global, vm-9.log-enable"
8.3,Ensure Adequate Audit Log Storage,"MON-02, MON-04","esx-9.hardware-boot, esx-9.hardware-management-log-forwarding, esx-9.log-audit-forwarding, esx-9.log-audit-local-capacity, esx-9.log-forwarding, guest-9.tools-log-forwarding, operations-9.log-collection, pnr-9.log-forwarding, vcenter-9.log-forwarding, vm-9.log-retention, vm-9.log-rotation-size"
8.4,Standardize Time Synchronization,"MON-02, MON-07.1","esx-9.hardware-management-log-forwarding, esx-9.hardware-management-time, esx-9.log-audit-forwarding, esx-9.log-forwarding, esx-9.time, fleet-9.time, guest-9.tools-log-forwarding, operations-9.log-collection, pnr-9.log-forwarding, pnr-9.time, vcenter-9.log-forwarding, vcenter-9.time"
8.5,Collect Detailed Audit Logs,"MON-02, MON-03","esx-9.hardware-management-log-forwarding, esx-9.log-audit-forwarding, esx-9.log-audit-local, esx-9.log-filter, esx-9.log-forwarding, esx-9.log-level, guest-9.tools-log-forwarding, guest-9.tools-logs, networks-9.audit-identity, nsx-9.log-level, operations-9.log-collection, pnr-9.log-forwarding, vcenter-9.log-forwarding, vcenter-9.logs-level-global, vm-9.log-enable"
8.6,Collect DNS Query Audit Logs,MON-02,"esx-9.hardware-management-log-forwarding, esx-9.log-audit-forwarding, esx-9.log-forwarding, guest-9.tools-log-forwarding, operations-9.log-collection, pnr-9.log-forwarding, vcenter-9.log-forwarding"
8.7,Collect URL Request Audit Logs,MON-02,"esx-9.hardware-management-log-forwarding, esx-9.log-audit-forwarding, esx-9.log-forwarding, guest-9.tools-log-forwarding, operations-9.log-collection, pnr-9.log-forwarding, vcenter-9.log-forwarding"
8.8,Collect Command-Line Audit Logs,MON-02,"esx-9.hardware-management-log-forwarding, esx-9.log-audit-forwarding, esx-9.log-forwarding, guest-9.tools-log-forwarding, operations-9.log-collection, pnr-9.log-forwarding, vcenter-9.log-forwarding"
8.9,Centralize Audit Logs,MON-02,"esx-9.hardware-management-log-forwarding, esx-9.log-audit-forwarding, esx-9.log-forwarding, guest-9.tools-log-forwarding, operations-9.log-collection, pnr-9.log-forwarding, vcenter-9.log-forwarding"
8.11,8.Conduct Audit Log Reviews,MON-02.2,"esx-9.hardware-management-log-forwarding, operations-9.log-collection"
8.12,8.Collect Service Provider Logs,MON-02,"esx-9.hardware-management-log-forwarding, esx-9.log-audit-forwarding, esx-9.log-forwarding, guest-9.tools-log-forwarding, operations-9.log-collection, pnr-9.log-forwarding, vcenter-9.log-forwarding"
9.6,Block Unnecessary File Types,NET-03,"nsx-9.ibgp-source-loopback, nsx-9.reverse-path-forwarding, operations-9.firewall-hardening, vcenter-9.network-mac-learning, vcenter-9.network-reject-forged-transmit-dvportgroup, vcenter-9.network-reject-mac-changes-dvportgroup, vcenter-9.network-reset-port, vcenter-9.network-restrict-netflow-usage, vcenter-9.network-restrict-port-level-overrides, vcenter-9.network-restrict-port-mirroring, vsan-9.hcl-internet, vsan-9.network-isolation-vsan-iscsi-target"
10.3,Disable Autorun and Autoplay for Removable Media,CFG-02,vcf-9.secure-baseline
10.4,Configure Automatic Anti-Malware Scanning of Removable Media,CFG-02,vcf-9.secure-baseline
10.5,Enable Anti-Exploitation Features,CFG-02,vcf-9.secure-baseline
11.2,Perform Automated Backups,BCD-11,nsx-9.backup
11.3,Protect Recovery Data,BCD-11.4,vcenter-9.native-key-provider-backup
12.1,Ensure Network Infrastructure is Up-to-Date,"VPM-04, VPM-04.1, VPM-05","esx-9.hardware-firmware-updates, esx-9.supported, esx-9.updates, guest-9.tools-updates, guest-9.tools-upgrade, vcenter-9.supported, vcenter-9.vami-updates, vm-9.virtual-hardware"
12.5,"Centralize Network Authentication, Authorization, and Auditing (AAA)","IAC-01.2, IAC-02, IAC-04","esx-9.iscsi-mutual-chap, vcenter-9.administration-sso-groups, vcf-9.mfa, vsan-9.iscsi-mutual-chap"
12.6,Use of Secure Network Management and Communication Protocols,NET-04,"esx-9.network-bpdu, esx-9.network-dvfilter, esx-9.network-rpf-promisc, esx-9.network-standard-reject-forged-transmit, esx-9.network-standard-reject-mac-changes, esx-9.network-standard-reject-promiscuous-mode, vcenter-9.network-reject-promiscuous-mode-dvportgroup, vcenter-9.network-restrict-netflow-usage, vcenter-9.network-vgt, vm-9.dvfilter, vsan-9.file-services-access-control-nfs"
12.7,Ensure Remote Devices Utilize a VPN and are Connecting to anEnterprise’s AAA Infrastructure,NET-14,pnr-9.ssh
13.1,Centralize Security Event Alerting,MON-02,"esx-9.hardware-management-log-forwarding, esx-9.log-audit-forwarding, esx-9.log-forwarding, guest-9.tools-log-forwarding, operations-9.log-collection, pnr-9.log-forwarding, vcenter-9.log-forwarding"
13.4,Perform Traffic Filtering Between Network Segments,"NET-04, NET-04.1","esx-9.firewall-incoming-default, esx-9.firewall-restrict-access, esx-9.network-bpdu, esx-9.network-dvfilter, esx-9.network-rpf-promisc, esx-9.network-standard-reject-forged-transmit, esx-9.network-standard-reject-mac-changes, esx-9.network-standard-reject-promiscuous-mode, operations-9.firewall-hardening, vcenter-9.network-reject-promiscuous-mode-dvportgroup, vcenter-9.network-restrict-netflow-usage, vcenter-9.network-vgt, vcenter-9.vami-firewall-restrict-access, vcf-9.perimeter-firewall, vm-9.dvfilter, vsan-9.file-services-access-control-nfs"
13.5,Manage Access Control for Remote Assets,NET-03,"nsx-9.ibgp-source-loopback, nsx-9.reverse-path-forwarding, operations-9.firewall-hardening, vcenter-9.network-mac-learning, vcenter-9.network-reject-forged-transmit-dvportgroup, vcenter-9.network-reject-mac-changes-dvportgroup, vcenter-9.network-reset-port, vcenter-9.network-restrict-netflow-usage, vcenter-9.network-restrict-port-level-overrides, vcenter-9.network-restrict-port-mirroring, vsan-9.hcl-internet, vsan-9.network-isolation-vsan-iscsi-target"
15.4,Ensure Service Provider Contracts Include Security Requirements,TPM-04,vcenter-9.administration-client-plugins
15.5,Assess Service Providers,TPM-04,vcenter-9.administration-client-plugins
16.7,Use Standard Hardening Configuration Templates for ApplicationInfrastructure,CFG-02,vcf-9.secure-baseline
18.3,Remediate Penetration Test Findings,"VPM-04, VPM-05","esx-9.hardware-firmware-updates, esx-9.supported, esx-9.updates, guest-9.tools-updates, guest-9.tools-upgrade, vcenter-9.vami-updates, vm-9.virtual-hardware"

regulatory-compliance/cloud-foundation/9.1/pci-dss-401/vcf-91-companion-pci-dss-401-scg-by-control.md

### Control 10.3

> 10.3 Audit logs are protected from destruction and unauthorized modifications.

### Control 10.4

> 10.4 Audit logs are reviewed to identify anomalies or suspicious activity.

### Control 10.5

> 10.5 Audit log history is retained and available for analysis.

### Control 11.2

> 11.2 2 An inventory of authorized wireless access points is maintained, including a documented business justification.

### Control 11.3

> 11.3 External and internal vulnerabilities are regularly identified, prioritized, and addressed.